{
  "id": "1719",
  "key": "metamorphic_mandible",
  "sourceKey": "item_metamorphic_mandible",
  "name": null,
  "aliases": [
    "item_metamorphic_mandible",
    "metamorphic_mandible"
  ],
  "description": "<h1>Active: Pupate</h1> Enter into an insect form for %duration% seconds, increasing magic resistance by %bonus_magic_resistance%%% and movement speed by %bonus_movespeed%%%. While an insect, your size is decreased and your armor is reduced by %armor_decrease%%%.",
  "lore": null,
  "notes": [],
  "neutralTiers": [
    4
  ],
  "cost": 0,
  "purchasable": false,
  "sellable": false,
  "ability": {
    "id": "item_metamorphic_mandible",
    "behavior": [
      "no-target"
    ],
    "dispellable": "yes",
    "dispelType": "basic",
    "tags": [
      "buff",
      "magic_resistance",
      "self_movement_speed"
    ],
    "type": "self-target",
    "cooldown": 30,
    "values": {
      "duration": {
        "value": 5,
        "apply_curio_bonus": 1
      },
      "bonus_magic_resistance": 50,
      "bonus_movespeed": 20,
      "size_decrease": 20,
      "armor_decrease": 45
    }
  }
}
