{
  "id": "1590",
  "key": "enhancement_boundless",
  "sourceKey": "item_enhancement_boundless",
  "name": "Boundless",
  "aliases": [
    "boundless",
    "enhancement_boundless",
    "item_enhancement_boundless"
  ],
  "description": null,
  "lore": null,
  "notes": [],
  "neutralTiers": [],
  "cost": 0,
  "purchasable": false,
  "sellable": false,
  "ability": {
    "id": "item_enhancement_boundless",
    "behavior": [
      "passive"
    ],
    "tags": [],
    "type": "passive",
    "values": {
      "bonus_attack_range": 150,
      "bonus_cast_range": 275
    }
  }
}
