{
  "id": "297",
  "key": "vampire_fangs",
  "sourceKey": "item_vampire_fangs",
  "name": "Vampire Fangs",
  "aliases": [
    "item_vampire_fangs",
    "vampire fangs",
    "vampire_fangs"
  ],
  "description": null,
  "lore": null,
  "notes": [],
  "neutralTiers": [],
  "cost": 0,
  "purchasable": false,
  "sellable": false,
  "ability": {
    "id": "item_vampire_fangs",
    "behavior": [
      "passive"
    ],
    "tags": [
      "buff",
      "spell_lifesteal"
    ],
    "type": "passive",
    "values": {
      "attack_lifesteal": [
        12,
        16,
        20
      ],
      "spell_lifesteal": [
        8,
        12,
        16
      ],
      "attack_damage": 0,
      "vision_loss": 0
    }
  }
}
