{
  "id": "220",
  "key": "travel_boots_2",
  "sourceKey": "item_travel_boots_2",
  "name": "Boots of Travel 2",
  "aliases": [
    "boots of travel",
    "boots of travel 2",
    "bot",
    "item_travel_boots_2",
    "tp",
    "travel_boots_2"
  ],
  "description": "<h1>Upgrade: Town Portal Scroll</h1>Upgrades your Town Portal Scroll, allowing it to target units and heroes, reduces cooldown, channel time and does not consume a charge on usage. \\nMovement speed bonuses from multiple pairs of boots do not stack.",
  "lore": "Winged boots that grant omnipresence.",
  "notes": [],
  "neutralTiers": [],
  "cost": 4500,
  "shopTags": [
    "teleport",
    "move-speed",
    "mobility"
  ],
  "quality": "common",
  "baseLevel": 2,
  "maxUpgradeLevel": 2,
  "ability": {
    "id": "item_travel_boots_2",
    "behavior": [
      "passive"
    ],
    "affects": [
      "allied-units"
    ],
    "tags": [
      "buff",
      "cooldown_reduction"
    ],
    "type": "passive",
    "values": {
      "bonus_movement_speed": 110,
      "maximum_distance": 800,
      "vision_radius": 200,
      "tp_cooldown": 40,
      "tp_channel_time": 2
    }
  }
}
