{
  "id": "1600",
  "key": "rippers_lash",
  "sourceKey": "item_rippers_lash",
  "name": null,
  "aliases": [
    "item_rippers_lash",
    "rippers_lash"
  ],
  "description": "<h1>Active: Flay</h1>Embeds thorns into all enemies in a %thorn_area% unit radius. Affected units take additional damage when attacked for %duration% seconds.",
  "lore": "The Fae horticulturists of Revtel are known to push the boundaries of both cross pollination and safety.",
  "notes": [],
  "neutralTiers": [],
  "cost": 0,
  "purchasable": false,
  "sellable": false,
  "ability": {
    "id": "item_rippers_lash",
    "behavior": [
      "point-target"
    ],
    "damageType": "physical",
    "tags": [
      "aoe"
    ],
    "type": "point",
    "manaCost": 0,
    "cooldown": 25,
    "castRange": 850,
    "values": {
      "thorn_area": 200,
      "bonus_damage_hero": 16,
      "bonus_damage_creep": 4,
      "duration": 10
    }
  }
}
