{
  "id": "55",
  "key": "hyperstone",
  "sourceKey": "item_hyperstone",
  "name": "Hyperstone",
  "aliases": [
    "hyperstone",
    "item_hyperstone"
  ],
  "description": null,
  "lore": "A mystical, carved stone that boosts the fervor of the holder.",
  "notes": [],
  "neutralTiers": [],
  "cost": 2000,
  "shopTags": [
    "attack-speed"
  ],
  "quality": "secret_shop",
  "ability": {
    "id": "item_hyperstone",
    "behavior": [
      "passive"
    ],
    "tags": [
      "buff",
      "self_attack_speed"
    ],
    "type": "passive",
    "values": {
      "bonus_attack_speed": 60
    }
  }
}
