{
  "id": "1715",
  "key": "recipe_specialists_array",
  "sourceKey": "item_recipe_specialists_array",
  "name": null,
  "aliases": [
    "item_recipe_specialists_array",
    "recipe_specialists_array"
  ],
  "description": null,
  "lore": null,
  "notes": [],
  "neutralTiers": [],
  "cost": 550,
  "shopTags": [],
  "recipe": true,
  "recipeResult": "item_specialists_array",
  "recipeRequirements": [
    [
      "item_blade_of_alacrity",
      "item_broadsword"
    ]
  ]
}
