{
  "id": "931",
  "key": "boots_of_bearing",
  "sourceKey": "item_boots_of_bearing",
  "name": "Boots of Bearing",
  "aliases": [
    "bongo boots",
    "boots of bearing",
    "boots_of_bearing",
    "item_boots_of_bearing",
    "marching boots"
  ],
  "description": "<h1>Active: Endurance</h1> Gives +%bonus_attack_speed_pct% attack speed and +%bonus_movement_speed_pct%%% movement speed to nearby allies for %duration% seconds. For the first %bonus_ms_duration% seconds allies are immune to slows.<br><br> Radius: %radius%  \\n\\n<h1>Passive: Swiftness Aura</h1>Grants %aura_movement_speed% movement speed and %aura_health_regen% health regeneration to allies.  <br><br>Radius: %radius%\\nMovement speed bonuses from multiple pairs of boots do not stack.",
  "lore": "Resplendent footwear fashioned for the ancient herald that first dared spread the glory of Stonehall beyond the original borders of its nascent claim.",
  "notes": [],
  "neutralTiers": [],
  "cost": 4225,
  "shopTags": [
    "str",
    "int",
    "damage",
    "move-speed",
    "attack-speed",
    "hard-to-tag",
    "mobility",
    "teamfight"
  ],
  "quality": "rare",
  "permanent": true,
  "ability": {
    "id": "item_boots_of_bearing",
    "behavior": [
      "no-target"
    ],
    "tags": [
      "ally_attack_speed",
      "ally_health_regen",
      "ally_movement_speed",
      "aura",
      "buff"
    ],
    "type": "self-target",
    "cooldown": 30,
    "sharedCooldown": "janggo",
    "values": {
      "aura_movement_speed": 15,
      "aura_health_regen": 2.5,
      "bonus_str": 8,
      "bonus_int": 0,
      "bonus_attack_speed_pct": 50,
      "bonus_movement_speed_pct": 15,
      "duration": 6,
      "radius": {
        "value": 1200,
        "affected_by_aoe_increase": 1
      },
      "bonus_movement_speed": 65,
      "bonus_health_regen": 18,
      "bonus_ms_duration": 1.5
    }
  }
}
