{
  "id": "990",
  "key": "eye_of_the_vizier",
  "sourceKey": "item_eye_of_the_vizier",
  "name": "Eye of the Vizier",
  "aliases": [
    "eye of the vizier",
    "eye_of_the_vizier",
    "item_eye_of_the_vizier"
  ],
  "description": null,
  "lore": "The ring of a cunning court mage who imprisoned a cadre of enemies to serve as his personal mana reserve.",
  "notes": [],
  "neutralTiers": [],
  "cost": 0,
  "purchasable": false,
  "sellable": false,
  "ability": {
    "id": "item_eye_of_the_vizier",
    "behavior": [
      "passive"
    ],
    "tags": [],
    "type": "passive",
    "values": {
      "cast_range_bonus": [
        125,
        135
      ],
      "bonus_mana_regen": [
        1,
        1.5
      ],
      "mana_reduction_pct": 15
    }
  }
}
