{
  "id": "910",
  "key": "recipe_revenants_brooch",
  "sourceKey": "item_recipe_revenants_brooch",
  "name": "Revenant's Brooch Recipe",
  "aliases": [
    "item_recipe_revenants_brooch",
    "recipe_revenants_brooch",
    "revenant's brooch recipe"
  ],
  "description": null,
  "lore": null,
  "notes": [],
  "neutralTiers": [],
  "cost": 650,
  "shopTags": [],
  "recipe": true,
  "recipeResult": "item_revenants_brooch",
  "recipeRequirements": [
    [
      "item_lesser_crit",
      "item_voodoo_mask"
    ]
  ]
}
