{
  "id": "107",
  "key": "recipe_ultimate_scepter",
  "sourceKey": "item_recipe_ultimate_scepter",
  "name": null,
  "aliases": [
    "item_recipe_ultimate_scepter",
    "recipe_ultimate_scepter"
  ],
  "description": null,
  "lore": null,
  "notes": [],
  "neutralTiers": [],
  "cost": 0,
  "shopTags": [],
  "recipe": true,
  "recipeResult": "item_ultimate_scepter",
  "recipeRequirements": [
    [
      "item_point_booster",
      "item_staff_of_wizardry",
      "item_ogre_axe",
      "item_blade_of_alacrity"
    ]
  ]
}
