{
  "id": "1127",
  "key": "recipe_pavise",
  "sourceKey": "item_recipe_pavise",
  "name": "Pavise Recipe",
  "aliases": [
    "item_recipe_pavise",
    "pavise recipe",
    "recipe_pavise"
  ],
  "description": null,
  "lore": null,
  "notes": [],
  "neutralTiers": [],
  "cost": 675,
  "shopTags": [],
  "recipe": true,
  "recipeResult": "item_pavise",
  "recipeRequirements": [
    [
      "item_wizard_hat",
      "item_fluffy_hat",
      "item_ring_of_protection"
    ]
  ]
}
