{
  "id": "358",
  "key": "dragon_scale",
  "sourceKey": "item_dragon_scale",
  "name": "Dragon Scale",
  "aliases": [
    "dragon scale",
    "dragon_scale",
    "item_dragon_scale"
  ],
  "description": "<h1>Passive: Afterburn</h1> Causes attacks to burn the enemy, dealing %damage_per_sec% damage per second for %duration% seconds. Affects buildings.",
  "lore": "The remains of a dragon always outvalue the wealth of even the most prodigious hoard.",
  "notes": [],
  "neutralTiers": [],
  "cost": 0,
  "purchasable": false,
  "sellable": false,
  "ability": {
    "id": "item_dragon_scale",
    "behavior": [
      "passive"
    ],
    "tags": [
      "damage_over_time"
    ],
    "type": "passive",
    "values": {
      "damage_per_sec": 22,
      "duration": 3
    }
  }
}
