{
  "id": "214",
  "key": "tranquil_boots",
  "sourceKey": "item_tranquil_boots",
  "name": "Tranquil Boots",
  "aliases": [
    "item_tranquil_boots",
    "tranquil boots",
    "tranquil_boots"
  ],
  "description": "<h1>Passive: Break</h1> Whenever you attack a hero or are attacked by any unit, the bonus %bonus_health_regen% HP regen is lost and the movement speed bonus is reduced to %broken_movement_speed% for %break_time% seconds.\\nMovement speed bonuses from multiple pairs of boots do not stack.",
  "lore": "While they increase the longevity of the wearer, this boot is not particularly reliable.",
  "notes": [],
  "neutralTiers": [],
  "cost": 900,
  "shopTags": [
    "move-speed",
    "regen-health",
    "armor"
  ],
  "quality": "rare",
  "ability": {
    "id": "item_tranquil_boots",
    "behavior": [
      "passive"
    ],
    "tags": [
      "buff",
      "self_health_regen"
    ],
    "type": "passive",
    "manaCost": 0,
    "cooldown": 13,
    "values": {
      "bonus_movement_speed": 65,
      "bonus_armor": 0,
      "bonus_health_regen": 14,
      "heal_duration": 20,
      "heal_amount": 250,
      "heal_interval": 0.334,
      "break_time": 13,
      "break_count": 1,
      "break_threshold": 20,
      "broken_movement_speed": 40
    }
  }
}
