{
  "id": "120",
  "key": "recipe_bloodstone",
  "sourceKey": "item_recipe_bloodstone",
  "name": "Bloodstone Recipe",
  "aliases": [
    "bloodstone recipe",
    "item_recipe_bloodstone",
    "recipe_bloodstone"
  ],
  "description": null,
  "lore": null,
  "notes": [],
  "neutralTiers": [],
  "cost": 0,
  "shopTags": [],
  "recipe": true,
  "recipeResult": "item_bloodstone",
  "recipeRequirements": [
    [
      "item_veil_of_discord",
      "item_soul_booster"
    ]
  ]
}
