{
  "id": "154",
  "key": "sange_and_yasha",
  "sourceKey": "item_sange_and_yasha",
  "name": "Sange and Yasha",
  "aliases": [
    "item_sange_and_yasha",
    "s&y",
    "sange and yasha",
    "sange_and_yasha",
    "sny",
    "sy"
  ],
  "description": null,
  "lore": "Sange and Yasha, when attuned by the moonlight and used together, become a very powerful combination.",
  "notes": [
    "Yasha-based movement speed bonuses from multiple items do not stack."
  ],
  "neutralTiers": [],
  "cost": 4200,
  "shopTags": [
    "damage",
    "str",
    "agi",
    "attack-speed",
    "unique",
    "dps"
  ],
  "quality": "artifact",
  "disassembleRule": "always",
  "ability": {
    "id": "item_sange_and_yasha",
    "behavior": [
      "passive"
    ],
    "tags": [],
    "type": "passive",
    "values": {
      "bonus_strength": 16,
      "bonus_agility": 16,
      "status_resistance": 16,
      "bonus_attack_speed": 20,
      "movement_speed_percent_bonus_melee": 12,
      "movement_speed_percent_bonus": 12,
      "hp_regen_amp": 16,
      "slow_resistance": 30
    }
  }
}
