{
  "id": "600",
  "key": "overwhelming_blink",
  "sourceKey": "item_overwhelming_blink",
  "name": "Overwhelming Blink",
  "aliases": [
    "blink dagger",
    "item_overwhelming_blink",
    "overwhelming blink",
    "overwhelming_blink"
  ],
  "description": "<h1>Active: Overwhelming Blink</h1> Teleport to a target point up to %blink_range% units away.<br><br>After teleportation, all enemies in a %radius% AoE take damage equal to %damage_base% + %damage_pct_instant%%% of your strength and an additional %damage_pct_over_time%%% over time, and have %movement_slow%%% movement speed slow and %attack_slow% attack speed slow for %duration% seconds. <br><br>Overwhelming Blink cannot be used for %blink_damage_cooldown% seconds after taking damage from an enemy hero or Roshan.",
  "lore": "A horrifying dagger forged in the chaos maw and nigh untouchable by mortal hands.",
  "notes": [
    "Self-casting will cause you to teleport in the direction of your team's fountain."
  ],
  "neutralTiers": [],
  "cost": 6800,
  "shopTags": [
    "teleport",
    "mobility",
    "escape"
  ],
  "quality": "component",
  "ability": {
    "id": "item_overwhelming_blink",
    "behavior": [
      "point-target"
    ],
    "damageType": "magical",
    "tags": [
      "blink",
      "damage_over_time",
      "enemy_attack_speed_reduction",
      "escape",
      "mobility",
      "self_reposition",
      "slow"
    ],
    "type": "point",
    "manaCost": 0,
    "cooldown": 15,
    "castRange": 1200,
    "castPoint": 0,
    "sharedCooldown": "blink",
    "values": {
      "blink_range": 1200,
      "blink_damage_cooldown": 3,
      "blink_range_clamp": 960,
      "bonus_strength": 25,
      "radius": {
        "value": 800,
        "affected_by_aoe_increase": 1
      },
      "movement_slow": 50,
      "attack_slow": 50,
      "duration": 6,
      "damage_base": 100,
      "damage_pct_instant": 50,
      "damage_pct_over_time": 100
    }
  }
}
