{
  "id": "41",
  "key": "bottle",
  "sourceKey": "item_bottle",
  "name": "Bottle",
  "aliases": [
    "bottle",
    "item_bottle"
  ],
  "description": "<h1>Active: Regenerate</h1>Consumes a charge to restore %health_restore% health and %mana_restore% mana over %restore_time% seconds. If the hero is attacked by an enemy hero or Roshan, the effect is lost.<br><br>The Bottle automatically refills at the fountain.<br><br>Hold Control to use on an allied hero.\\n\\n<h1>Passive:  Store Rune</h1>Runes can be stored in the Bottle for later use by right-clicking them. Unused runes will automatically activate after 90 seconds.<br><br>Using a stored rune fully refills the Bottle.",
  "lore": "An old bottle that survived the ages, the contents placed inside become enchanted.",
  "notes": [
    "Bottle is shareable. Stored runes cannot be shared.",
    "Using a stored Bounty or Water rune fully refills the bottle if the bottle was full when the rune was stored; otherwise, it refills two charges."
  ],
  "neutralTiers": [],
  "cost": 675,
  "shopTags": [
    "consumable",
    "laning"
  ],
  "quality": "common",
  "permanent": true,
  "stackable": false,
  "displayCharges": 1,
  "initialCharges": 3,
  "shareability": "partially-shareable",
  "ability": {
    "id": "item_bottle",
    "behavior": [
      "no-target"
    ],
    "affects": [
      "allied-heroes"
    ],
    "tags": [
      "self_heal",
      "self_mana_restore"
    ],
    "type": "self-target",
    "cooldown": 0.5,
    "castRange": 350,
    "castPoint": 0,
    "values": {
      "health_restore": 110,
      "mana_restore": 60,
      "health_restore_pct": 0,
      "mana_restore_pct": 0,
      "restore_time": 2.7,
      "max_charges": 3,
      "break_on_hero_damage": 1,
      "rune_expire_time": 90
    }
  }
}
