{
  "id": "113",
  "key": "recipe_heart",
  "sourceKey": "item_recipe_heart",
  "name": "Heart of Tarrasque Recipe",
  "aliases": [
    "heart of tarrasque recipe",
    "item_recipe_heart",
    "recipe_heart"
  ],
  "description": null,
  "lore": null,
  "notes": [],
  "neutralTiers": [],
  "cost": 800,
  "shopTags": [],
  "recipe": true,
  "recipeResult": "item_heart",
  "recipeRequirements": [
    [
      "item_reaver",
      "item_ring_of_tarrasque"
    ]
  ]
}
