{
  "id": "365",
  "key": "panic_button",
  "sourceKey": "item_panic_button",
  "name": null,
  "aliases": [
    "item_panic_button",
    "panic_button"
  ],
  "description": "<h1>Passive: Rejuvenate</h1> When the wearer's health falls below %health_threshold%%%, they will receive a strong dispel and be healed for %heal% health.<br/><br/>Dispel Type: <span class=\"GameplayValues GameplayVariable\">Strong Dispel</span>",
  "lore": null,
  "notes": [],
  "neutralTiers": [],
  "cost": 0,
  "purchasable": false,
  "sellable": false,
  "ability": {
    "id": "item_panic_button",
    "behavior": [
      "passive"
    ],
    "tags": [
      "self_heal"
    ],
    "type": "passive",
    "cooldown": 75,
    "values": {
      "bonus_health": 0,
      "heal": 1500,
      "health_threshold": 20
    }
  }
}
