{
  "id": "200",
  "key": "recipe_dagon_5",
  "sourceKey": "item_recipe_dagon_5",
  "name": null,
  "aliases": [
    "item_recipe_dagon_5",
    "recipe_dagon_5"
  ],
  "description": null,
  "lore": null,
  "notes": [],
  "neutralTiers": [],
  "cost": 0,
  "shopTags": [],
  "recipe": true,
  "recipeResult": "item_dagon_5",
  "recipeRequirements": [
    [
      "item_dagon_4",
      "item_recipe_dagon"
    ]
  ]
}
