{
  "id": "293",
  "key": "phoenix_ash",
  "sourceKey": "item_phoenix_ash",
  "name": "Phoenix Ash",
  "aliases": [
    "item_phoenix_ash",
    "phoenix ash",
    "phoenix_ash"
  ],
  "description": "<h1>Passive: Rebirth</h1>Lethal damage is prevented and instead the wearer is healed to half health and non-ultimate ability cooldowns reset. Gets consumed on trigger.",
  "lore": null,
  "notes": [],
  "neutralTiers": [],
  "cost": 0,
  "purchasable": false,
  "sellable": false,
  "permanent": false,
  "initialCharges": 1,
  "ability": {
    "id": "item_phoenix_ash",
    "behavior": [
      "passive"
    ],
    "tags": [],
    "type": "passive",
    "values": {
      "health_pct": 50
    }
  }
}
