{
  "id": "950",
  "key": "defiant_shell",
  "sourceKey": "item_defiant_shell",
  "name": null,
  "aliases": [
    "defiant_shell",
    "item_defiant_shell"
  ],
  "description": "<h1>Passive: Reciprocity</h1> When attacked, the hero counter-attacks a target within their attack range for %counter_damage%%% of their regular attack damage.",
  "lore": null,
  "notes": [],
  "neutralTiers": [
    2
  ],
  "cost": 0,
  "purchasable": false,
  "sellable": false,
  "ability": {
    "id": "item_defiant_shell",
    "behavior": [
      "passive"
    ],
    "tags": [],
    "type": "passive",
    "cooldown": 5,
    "values": {
      "counter_damage": {
        "value": 80,
        "apply_curio_bonus": true
      }
    }
  }
}
