{
  "id": "2095",
  "key": "tier5_token",
  "sourceKey": "item_tier5_token",
  "name": "Tier 5 Token",
  "aliases": [
    "item_tier5_token",
    "tier 5 token",
    "tier5_token"
  ],
  "description": "Activate to redeem a Tier 5 Neutral Item. The resulting neutral item isn't shareable and a hero can only redeem a single token per tier.",
  "lore": null,
  "notes": [],
  "neutralTiers": [],
  "purchasable": false,
  "sellable": false,
  "shareability": "fully-shareable",
  "ability": {
    "id": "item_tier5_token",
    "behavior": [
      "no-target"
    ],
    "tags": [],
    "type": "self-target"
  }
}
